{
 "$schema": "http://json-schema.org/draft-07/schema#",
 "title": "PokeFan Chess region journey",
 "type": "object",
 "required": [
  "schema",
  "region",
  "rival",
  "places"
 ],
 "additionalProperties": false,
 "properties": {
  "schema": {
   "const": 1
  },
  "region": {
   "type": "string",
   "pattern": "^[a-z]+$"
  },
  "rival": {
   "type": "object",
   "required": [
    "class",
    "name",
    "counter"
   ],
   "additionalProperties": false,
   "properties": {
    "class": {
     "type": "string",
     "pattern": "^trainer\\.class\\."
    },
    "name": {
     "type": "string",
     "pattern": "^trainer\\.name\\."
    },
    "counter": {
     "type": "object",
     "additionalProperties": {
      "type": "string"
     }
    }
   }
  },
  "places": {
   "type": "array",
   "minItems": 2,
   "items": {
    "type": "object",
    "required": [
     "id",
     "kind"
    ],
    "additionalProperties": false,
    "properties": {
     "id": {
      "type": "string",
      "pattern": "^[a-z0-9-]+$"
     },
     "kind": {
      "enum": [
       "town",
       "route",
       "rival",
       "gym",
       "challenge",
       "drill",
       "league",
       "champion"
      ]
     },
     "name": {
      "type": "string"
     },
     "route": {
      "type": "string"
     },
     "story": {
      "type": "array",
      "minItems": 1,
      "maxItems": 3,
      "items": {
       "type": "string",
       "pattern": "^story\\."
      }
     },
     "trainers": {
      "type": "array",
      "minItems": 1,
      "maxItems": 4,
      "items": {
       "type": "object",
       "required": [
        "id",
        "class",
        "name",
        "team",
        "defeat",
        "puzzles",
        "need"
       ],
       "additionalProperties": false,
       "properties": {
        "id": {
         "type": "string",
         "pattern": "^[a-z0-9-]+$"
        },
        "class": {
         "type": "string",
         "pattern": "^trainer\\.class\\."
        },
        "name": {
         "type": "string",
         "pattern": "^trainer\\.name\\."
        },
        "team": {
         "type": "array",
         "minItems": 1,
         "maxItems": 3,
         "items": {
          "type": "string"
         }
        },
        "defeat": {
         "type": "string",
         "pattern": "^line\\."
        },
        "puzzles": {
         "type": "integer",
         "minimum": 1,
         "maximum": 5
        },
        "need": {
         "type": "integer",
         "minimum": 1,
         "maximum": 5
        },
        "themes": {
         "enum": [
          "route",
          "learned"
         ]
        },
        "topics": {
         "type": "array",
         "minItems": 1,
         "items": {
          "type": "string"
         }
        },
        "sprite": {
         "type": "string"
        },
        "easy": {
         "type": "boolean"
        },
        "boost": {
         "type": "integer",
         "minimum": 0,
         "maximum": 500
        },
        "lesson": {
         "type": "string",
         "pattern": "^[a-z0-9-]+$"
        }
       }
      }
     },
     "leader": {
      "type": "string",
      "pattern": "^[a-z]+$"
     },
     "badge": {
      "type": "string",
      "pattern": "^[a-z]+$"
     },
     "optional": {
      "type": "boolean"
     },
     "oneMove": {
      "type": "boolean"
     },
     "here": {
      "type": "string",
      "pattern": "^town\\."
     },
     "reward": {
      "type": "object",
      "additionalProperties": false,
      "properties": {
       "gift": {
        "type": "array",
        "items": {
         "type": "string"
        }
       },
       "choice": {
        "type": "array",
        "minItems": 2,
        "items": {
         "type": "string"
        }
       }
      }
     },
     "drills": {
      "type": "array",
      "minItems": 1,
      "items": {
       "type": "object",
       "required": [
        "id",
        "title",
        "goal",
        "fen",
        "limit"
       ],
       "additionalProperties": false,
       "properties": {
        "id": {
         "type": "string"
        },
        "title": {
         "type": "string",
         "pattern": "^drill\\."
        },
        "goal": {
         "type": "string",
         "pattern": "^drill\\."
        },
        "fen": {
         "type": "string"
        },
        "limit": {
         "type": "integer",
         "minimum": 1,
         "maximum": 50
        }
       }
      }
     }
    },
    "allOf": [
     {
      "if": {
       "properties": {
        "kind": {
         "const": "route"
        }
       }
      },
      "then": {
       "required": [
        "route",
        "trainers"
       ]
      }
     },
     {
      "if": {
       "properties": {
        "kind": {
         "const": "rival"
        }
       }
      },
      "then": {
       "required": [
        "name",
        "trainers"
       ]
      }
     },
     {
      "if": {
       "properties": {
        "kind": {
         "enum": [
          "town",
          "gym"
         ]
        }
       }
      },
      "then": {
       "required": [
        "name"
       ]
      }
     },
     {
      "if": {
       "properties": {
        "kind": {
         "enum": [
          "gym",
          "challenge",
          "league"
         ]
        }
       }
      },
      "then": {
       "required": [
        "name",
        "trainers"
       ]
      }
     },
     {
      "if": {
       "properties": {
        "kind": {
         "const": "drill"
        }
       }
      },
      "then": {
       "required": [
        "name",
        "drills"
       ]
      }
     },
     {
      "if": {
       "properties": {
        "kind": {
         "const": "gym"
        }
       }
      },
      "then": {
       "required": [
        "badge",
        "leader"
       ]
      }
     }
    ]
   }
  }
 }
}
