{
 "schema": 1,
 "region": "kanto",
 "rival": {
  "class": "trainer.class.rival",
  "name": "trainer.name.blue",
  "counter": {
   "bulbasaur": "charmander",
   "charmander": "squirtle",
   "squirtle": "bulbasaur"
  }
 },
 "places": [
  {
   "id": "pallet",
   "kind": "town",
   "name": "place.pallet",
   "story": [
    "story.oak.1",
    "story.oak.2",
    "story.oak.3"
   ]
  },
  {
   "id": "route-1",
   "kind": "route",
   "route": "route-1",
   "trainers": [
    {
     "id": "r1-toby",
    "easy": true,
     "class": "trainer.class.youngster",
     "name": "trainer.name.toby",
     "team": [
      "rattata"
     ],
     "defeat": "line.r1-toby",
     "puzzles": 3,
     "need": 2
    },
    {
     "id": "r1-mina",
    "easy": true,
     "class": "trainer.class.lass",
     "name": "trainer.name.mina",
     "team": [
      "pidgey",
      "pidgey"
     ],
     "defeat": "line.r1-mina",
     "puzzles": 3,
     "need": 2
    }
   ]
  },
  {
   "id": "viridian",
   "kind": "town",
   "name": "place.viridian",
   "story": [
    "story.viridian.1",
    "story.viridian.2"
   ],
   "here": "town.viridian.here"
  },
  {
   "id": "rival-1",
   "kind": "rival",
   "name": "place.rival",
   "story": [
    "story.rival1.1",
    "story.rival1.2"
   ],
   "trainers": [
    {
     "id": "rival-1",
     "class": "trainer.class.rival",
     "name": "trainer.name.blue",
     "team": [
      "@counter",
      "pidgey"
     ],
     "defeat": "line.rival-1",
     "puzzles": 5,
     "need": 3,
     "themes": "learned"
    }
   ],
   "reward": {
    "gift": [
     "@starter-other"
    ]
   }
  },
  {
   "id": "viridian-forest",
   "kind": "route",
   "route": "viridian-forest",
   "trainers": [
    {
     "id": "vf-oskar",
     "class": "trainer.class.bugcatcher",
     "name": "trainer.name.oskar",
     "team": [
      "weedle",
      "caterpie"
     ],
     "defeat": "line.vf-oskar",
     "puzzles": 3,
     "need": 2
    },
    {
     "id": "vf-liam",
     "class": "trainer.class.bugcatcher",
     "name": "trainer.name.liam",
     "team": [
      "kakuna",
      "metapod",
      "weedle"
     ],
     "defeat": "line.vf-liam",
     "puzzles": 3,
     "need": 2
    },
    {
     "id": "vf-pip",
     "class": "trainer.class.bugcatcher",
     "name": "trainer.name.pip",
     "team": [
      "caterpie",
      "metapod"
     ],
     "defeat": "line.vf-pip",
     "puzzles": 3,
     "need": 2
    }
   ]
  },
  {
   "id": "pewter-gym",
   "kind": "gym",
   "name": "gym.1",
   "leader": "brock",
   "badge": "boulder",
   "story": [
    "story.pewter-gym.1"
   ],
   "trainers": [
    {
     "id": "gym-brock",
     "class": "trainer.class.leader",
     "name": "trainer.name.brock",
     "team": [
      "geodude",
      "onix"
     ],
     "defeat": "line.gym-brock",
     "puzzles": 5,
     "need": 3,
     "topics": [
      "castling",
      "hangingPiece"
     ],
     "sprite": "brock",
     "lesson": "pewter-gym"
    }
   ]
  },
  {
   "id": "route-3",
   "kind": "route",
   "route": "route-3",
   "trainers": [
    {
     "id": "r3-dev",
     "class": "trainer.class.youngster",
     "name": "trainer.name.dev",
     "team": [
      "spearow"
     ],
     "defeat": "line.r3-dev",
     "puzzles": 3,
     "need": 2
    },
    {
     "id": "r3-rosa",
     "class": "trainer.class.lass",
     "name": "trainer.name.rosa",
     "team": [
      "jigglypuff",
      "pidgey"
     ],
     "defeat": "line.r3-rosa",
     "puzzles": 3,
     "need": 2
    },
    {
     "id": "r3-finn",
     "class": "trainer.class.bugcatcher",
     "name": "trainer.name.finn",
     "team": [
      "caterpie",
      "weedle",
      "spearow"
     ],
     "defeat": "line.r3-finn",
     "puzzles": 3,
     "need": 2
    }
   ]
  },
  {
   "id": "mt-moon",
   "kind": "challenge",
   "name": "place.mt-moon",
   "optional": true,
   "story": [
    "story.mt-moon.1"
   ],
   "trainers": [
    {
     "id": "mm-gus",
     "class": "trainer.class.supernerd",
     "name": "trainer.name.gus",
     "team": [
      "zubat",
      "paras",
      "clefairy"
     ],
     "defeat": "line.mm-gus",
     "puzzles": 3,
     "need": 2,
     "topics": [
      "trappedPiece",
      "hangingPiece"
     ],
     "lesson": "mt-moon"
    }
   ],
   "reward": {
    "gift": [
     "magikarp"
    ],
    "choice": [
     "omanyte",
     "kabuto"
    ]
   }
  },
  {
   "id": "rival-2",
   "kind": "rival",
   "name": "place.rival",
   "story": [
    "story.rival2.1",
    "story.rival2.2"
   ],
   "trainers": [
    {
     "id": "rival-2",
     "class": "trainer.class.rival",
     "name": "trainer.name.blue",
     "team": [
      "@counter",
      "pidgeotto",
      "rattata"
     ],
     "defeat": "line.rival-2",
     "puzzles": 5,
     "need": 3,
     "themes": "learned"
    }
   ],
   "reward": {
    "gift": [
     "@starter-rival"
    ]
   }
  },
  {
   "id": "cerulean-gym",
   "kind": "gym",
   "name": "gym.2",
   "leader": "misty",
   "badge": "cascade",
   "story": [
    "story.cerulean-gym.1"
   ],
   "trainers": [
    {
     "id": "gym-misty",
     "class": "trainer.class.leader",
     "name": "trainer.name.misty",
     "team": [
      "staryu",
      "starmie"
     ],
     "defeat": "line.gym-misty",
     "puzzles": 5,
     "need": 3,
     "topics": [
      "hangingPiece",
      "trappedPiece",
      "advantage"
     ],
     "sprite": "misty",
     "lesson": "cerulean-gym"
    }
   ]
  },
  {
   "id": "route-6",
   "kind": "route",
   "route": "route-6",
   "trainers": [
    {
     "id": "r6-kai",
     "class": "trainer.class.camper",
     "name": "trainer.name.kai",
     "team": [
      "mankey"
     ],
     "defeat": "line.r6-kai",
     "puzzles": 3,
     "need": 2
    },
    {
     "id": "r6-noor",
     "class": "trainer.class.picnicker",
     "name": "trainer.name.noor",
     "team": [
      "oddish",
      "bellsprout"
     ],
     "defeat": "line.r6-noor",
     "puzzles": 3,
     "need": 2
    }
   ]
  },
  {
   "id": "vermilion-gym",
   "kind": "gym",
   "name": "gym.3",
   "leader": "ltsurge",
   "badge": "thunder",
   "story": [
    "story.vermilion-gym.1"
   ],
   "trainers": [
    {
     "id": "gym-ltsurge",
     "class": "trainer.class.leader",
     "name": "trainer.name.ltsurge",
     "team": [
      "voltorb",
      "pikachu",
      "raichu"
     ],
     "defeat": "line.gym-ltsurge",
     "puzzles": 5,
     "need": 3,
     "topics": [
      "fork"
     ],
     "sprite": "ltsurge",
     "lesson": "vermilion-gym"
    }
   ]
  },
  {
   "id": "power-plant",
   "kind": "challenge",
   "name": "place.power-plant",
   "optional": true,
   "story": [
    "story.power-plant.1"
   ],
   "trainers": [
    {
     "id": "legend-zapdos",
     "class": "trainer.class.legend",
     "name": "trainer.name.zapdos",
     "team": [
      "zapdos"
     ],
     "defeat": "line.legend-zapdos",
     "puzzles": 5,
     "need": 4,
     "topics": [
      "fork",
      "doubleCheck"
     ],
     "sprite": "-",
     "boost": 150,
     "lesson": "power-plant"
    }
   ],
   "reward": {
    "gift": [
     "zapdos"
    ]
   }
  },
  {
   "id": "route-7",
   "kind": "route",
   "route": "route-7",
   "trainers": [
    {
     "id": "r7-ines",
     "class": "trainer.class.picnicker",
     "name": "trainer.name.ines",
     "team": [
      "vulpix",
      "oddish"
     ],
     "defeat": "line.r7-ines",
     "puzzles": 3,
     "need": 2
    },
    {
     "id": "r7-theo",
     "class": "trainer.class.camper",
     "name": "trainer.name.theo",
     "team": [
      "growlithe",
      "meowth"
     ],
     "defeat": "line.r7-theo",
     "puzzles": 3,
     "need": 2
    }
   ]
  },
  {
   "id": "celadon-gym",
   "kind": "gym",
   "name": "gym.4",
   "leader": "erika",
   "badge": "rainbow",
   "story": [
    "story.celadon-gym.1"
   ],
   "trainers": [
    {
     "id": "gym-erika",
     "class": "trainer.class.leader",
     "name": "trainer.name.erika",
     "team": [
      "victreebel",
      "tangela",
      "vileplume"
     ],
     "defeat": "line.gym-erika",
     "puzzles": 5,
     "need": 3,
     "topics": [
      "promotion",
      "advancedPawn"
     ],
     "sprite": "erika",
     "lesson": "celadon-gym"
    }
   ],
   "reward": {
    "gift": [
     "eevee"
    ]
   }
  },
  {
   "id": "game-corner",
   "kind": "challenge",
   "name": "place.game-corner",
   "optional": true,
   "story": [
    "story.game-corner.1"
   ],
   "trainers": [
    {
     "id": "gc-rocco",
     "class": "trainer.class.gambler",
     "name": "trainer.name.rocco",
     "team": [
      "porygon"
     ],
     "defeat": "line.gc-rocco",
     "puzzles": 3,
     "need": 2,
     "topics": [
      "advantage",
      "fork"
     ],
     "lesson": "game-corner"
    }
   ],
   "reward": {
    "gift": [
     "porygon"
    ]
   }
  },
  {
   "id": "route-14",
   "kind": "route",
   "route": "route-14",
   "trainers": [
    {
     "id": "r14-sasha",
     "class": "trainer.class.birdkeeper",
     "name": "trainer.name.sasha",
     "team": [
      "pidgey",
      "pidgeotto"
     ],
     "defeat": "line.r14-sasha",
     "puzzles": 3,
     "need": 2
    },
    {
     "id": "r14-omar",
     "class": "trainer.class.biker",
     "name": "trainer.name.omar",
     "team": [
      "venonat",
      "ditto"
     ],
     "defeat": "line.r14-omar",
     "puzzles": 3,
     "need": 2
    }
   ]
  },
  {
   "id": "fuchsia-gym",
   "kind": "gym",
   "name": "gym.5",
   "leader": "koga",
   "badge": "soul",
   "story": [
    "story.fuchsia-gym.1"
   ],
   "trainers": [
    {
     "id": "gym-koga",
     "class": "trainer.class.leader",
     "name": "trainer.name.koga",
     "team": [
      "koffing",
      "muk",
      "weezing"
     ],
     "defeat": "line.gym-koga",
     "puzzles": 5,
     "need": 4,
     "topics": [
      "pin"
     ],
     "sprite": "koga",
     "lesson": "fuchsia-gym"
    }
   ]
  },
  {
   "id": "seafoam",
   "kind": "challenge",
   "name": "place.seafoam",
   "optional": true,
   "story": [
    "story.seafoam.1"
   ],
   "trainers": [
    {